Categoria,Codigo,area Conocimiento,Tipo de Cargo,Nombre del Perfil,Descripcion del Cargo,Responsabilidades,Requisitos del Puesto
1. Infraestructura Operaciones,INF001,Infraestructura y Operaciones,Líder,Arquitecto TI,La función del arquitecto de TI es desarrollar y mantener el plan de diseño de alto nivel para la arquitectura de TI lógica y técnica general. Esta persona proporcionará liderazgo técnico y consultoría en toda la organización desde la toma de decisiones estratégicas hasta el nivel de planificación del proyecto. El arquitecto de TI obtendrá el compromiso organizacional para todos los planes de infraestructura de alto nivel e iniciará y participará en proyectos para evaluar tecnologías y métodos para implementar estos planes.,"Estrategia y Planificación
 Mantener un conocimiento profundo de los planes estratégicos del negocio de la empresa.
 Proporcionar experiencia dirección y asistencia en consultoría arquitectónica a analistas de sistemas ingenieros de sistemas y otros arquitectos de sistemas.
 Documentar y desarrollar un conocimiento profundo de la arquitectura/infraestructura de TI y la cartera de tecnología existente de la empresa.
 Desarrollar y gestionar un plan de capacidad de infraestructura.
 Desarrollar documentar comunicar y hacer cumplir una política de estándares tecnológicos.
 Realizar investigaciones sobre tecnologías emergentes en apoyo de los esfuerzos de desarrollo de infraestructura y recomendar tecnologías que aumenten la rentabilidad y la flexibilidad de la infraestructura.
 Desarrollar documentar hacer recomendaciones y comunicar planes para invertir en infraestructura de TI incluido el análisis de oportunidades de reducción de costos.
 Diseñar desarrollar y supervisar la implementación de sistemas integrados de extremo a extremo.
 Desarrollar y ejecutar planes de prueba para verificar el desempeño técnico de la infraestructura y los sistemas. Informar sobre los hallazgos y hacer recomendaciones de mejora.
 
 Gestión Operativa
 Colaborar con los usuarios finales y la alta dirección para definir los requisitos comerciales para el desarrollo de sistemas complejos y obtener aceptación para todos los planes de infraestructura.
 Revisar proyectos de TI diseños de sistemas y planes de adquisiciones/subcontratación nuevos y existentes para verificar el cumplimiento de los estándares de TI y los planes arquitectónicos.
 Proporcionar orientación a los miembros jóvenes del equipo.","Educación Formal y Certificación
 Diploma universitario o título universitario en el campo de la informática los sistemas de información o la ingeniería informática.
 Certificaciones en […].
 
 Conocimiento y Experiencia
 […] años de experiencia laboral.
 Amplia experiencia en el desarrollo de planes estratégicos. 
 Experiencia práctica en recopilación/análisis de requisitos comerciales.
 Experiencia contrastada en diseño y desarrollo de sistemas.
 Fuerte comprensión de los principios y prácticas de procesamiento de información.
 Base sólida en aplicaciones empresariales básicas incluidas […].
 Conocimiento técnico profundo de los sistemas operativos de redes PC y plataformas incluido […].
 Conocimiento técnico práctico del software los protocolos y los estándares de los sistemas actuales incluido […].
 Conocimiento experto de lenguajes de programación incluido […].
 Experiencia práctica con herramientas de desarrollo de aplicaciones incluido […].
 Fuerte conocimiento de los principios y prácticas de evaluación de hardware y software.
 Experiencia comprobada en planificación y gestión de proyectos.
 Buen conocimiento de las prácticas y leyes de privacidad de datos aplicables.
 Excepcionales habilidades analíticas conceptuales y de resolución de problemas.
 Comprensión excepcional de las metas y objetivos de la organización.
 
 Atributos personales
 Habilidades superiores de comunicación escrita y oral.
 Excelentes habilidades en arquitectura técnica y documentación de soporte técnico.
 Fuertes habilidades interpersonales y de consulta.
 Capacidad para realizar investigaciones sobre tecnologías y tendencias emergentes estándares y productos según sea necesario.
 Capacidad para presentar ideas en un lenguaje fácil de usar.
 Capacidad para priorizar y ejecutar tareas de manera efectiva en un entorno de alta presión.
 Experiencia trabajando en un entorno colaborativo y orientado al equipo."
1. Infraestructura Operaciones,INF002,Infraestructura y Operaciones,Líder,Gerente de Mesa de Servicio,La función del gerente de la mesa de servicio es supervisar a todo el personal de la mesa de servicio y garantizar que los usuarios finales reciban la asistencia adecuada. Esto incluye la responsabilidad de gestionar todos los procedimientos relacionados con la identificación priorización y resolución de incidentes incluido el seguimiento seguimiento y coordinación de las funciones del Service Desk. El Service Desk Manager también es responsable de planificar diseñar y analizar el service desk de la organización de acuerdo con las mejores prácticas garantizando al mismo tiempo altos niveles de calidad y disponibilidad del servicio al cliente. Esta persona desarrollará implementará y supervisará políticas y procedimientos para garantizar niveles de servicio consistentes y resoluciones rápidas. El gerente de la mesa de servicio también es responsable de la planificación de la capacidad de dotación de personal el diseño del proceso de servicio el análisis del desempeño y el desarrollo de planes de resolución proactivos. El gerente de la mesa de servicio también contribuirá a la resolución mejorada de problemas brindando soporte práctico y en persona a los usuarios finales cuando sea necesario.,"Estrategia y Planificación
 Desarrollar acuerdos de nivel de servicio (SLA) para establecer expectativas y plazos de resolución de problemas.
 Desarrollar políticas y procedimientos que describan cómo se identifican documentan asignan y corrigen los problemas.
 Analizar el desempeño de las actividades de la mesa de servicio y las resoluciones documentadas identificar áreas problemáticas e idear y ofrecer soluciones para mejorar la calidad del servicio y prevenir problemas futuros. 
 Planificar y realizar evaluaciones de desempeño del personal de la Mesa de Servicio administrar medidas disciplinarias aumentos bonificaciones y promociones cuando sea necesario.
 
 Adquisición e Implementación
 Elaborar propuestas presupuestarias y declaraciones de gastos operativos. 
 Colaborar con otros departamentos para identificar y/o adquirir software de Service Desk para el personal interno y clientes externos.
 Realizar investigaciones sobre productos servicios protocolos y estándares emergentes en apoyo de los esfuerzos de desarrollo y adquisición de tecnología de la mesa de servicio.
 Servir de enlace con proveedores para la adquisición de nuevas tecnologías de sistemas Supervisar la instalación y resolver problemas de adaptación.
 Garantizar iniciativas de formación adecuadas para el personal nuevo y existente.
 Realizar tareas de compras y despliegue.
 Considerar palabras clave para los roles de líder de TI: autorizar comprar supervisar.
 Considerar palabras clave para roles prácticos: instalar implementar configurar.
 
 Gestión Operativa
 Administrar el procesamiento de llamadas entrantes a la mesa de servicio por teléfono y correo electrónico para garantizar una resolución cortés oportuna y efectiva de los problemas de los usuarios finales.
 Desarrollar y hacer cumplir políticas y procedimientos de manejo y escalamiento de solicitudes.
 Realizar un seguimiento y analizar tendencias en las solicitudes de la mesa de servicio y generar informes estadísticos.
 Evaluar la necesidad de cualquier reconfiguración del sistema (menor o significativa) en función de las tendencias de las solicitudes y haga recomendaciones.
 Identificar recomendar desarrollar e implementar programas de capacitación de usuarios finales para aumentar los conocimientos informáticos y la autosuficiencia.
 Supervisar el desarrollo y la comunicación de hojas de ayuda guías de uso y preguntas frecuentes para los usuarios finales.
 Asistir a seminarios de capacitación conferencias y ferias comerciales para ampliar el conocimiento de los problemas y tecnologías actuales y futuros de Service Desk.
 Supervisar el desarrollo implementación y administración de los procedimientos y políticas de capacitación del personal de la mesa de servicio.
 Capacitar entrenar y orientar a los técnicos de la mesa de servicio y a otro personal subalterno.
 Gestionar las actividades generales del escritorio y el personal.
 Contribuir a una mayor resolución de problemas brindando soporte práctico y en persona a los usuarios finales cuando sea necesario.
 Asistir a las reuniones de la Junta Asesora de Cambios (CAB).
 Supervisar las tendencias de incidentes y anticipe problemas potenciales para una resolución proactiva.","Educación formal y certificación
 Diploma/Título universitario o título universitario en el campo de la informática y/o […] años de experiencia laboral equivalente.
 Certificación en ITIL […].
 
 Conocimiento y experiencia
 Amplia experiencia en soporte de aplicaciones con […].
 Amplios conocimientos de hardware informático incluido […].
 Conocimiento práctico de una variedad de utilidades de diagnóstico incluido […].
 Experiencia con sistemas operativos de escritorio y servidores incluido […]. 
 Familiaridad con los principios avanzados de ITIL […].
 Historial comprobado en el desarrollo y suministro de SLA y entregables de Service Desk.
 Experiencia progresiva demostrada en la gestión de un equipo de soporte técnico.
 
 Atributos personales
 Sólidas habilidades de gestión de relaciones y gestión del desempeño.
 Capacidad para motivar y dirigir a los miembros del personal y subordinados.
 Fuerte orientación al servicio al cliente.
 Capacidad analítica y de resolución de problemas demostradas.
 Capacidad para priorizar y ejecutar tareas de manera efectiva en un entorno de alta presión.
 Buenas habilidades de comunicación escrita oral e interpersonal.
 Habilidades interpersonales excepcionales con especial atención a las habilidades para escuchar y cuestionar.
 Capacidad para realizar investigaciones sobre […] problemas y productos según sea necesario.
 Capacidad para presentar ideas en un lenguaje amigable para los negocios y para el usuario.
 Altamente automotivado y dirigido.
 Gran atención al detalle.
 Orientado al equipo y capacitado para trabajar en un entorno colaborativo."
1. Infraestructura Operaciones,INF003,Infraestructura y Operaciones,Contribución Individual,Administrador de Exchange,La función del Administrador de Exchange es administrar los servidores de Exchange y los componentes relacionados para lograr una alta disponibilidad y rendimiento de las diversas aplicaciones comerciales admitidas. Esta persona también participa en la planificación e implementación de políticas y procedimientos para garantizar que el aprovisionamiento y el mantenimiento de Exchange sean coherentes con los objetivos de la empresa las mejores prácticas de la industria y los requisitos reglamentarios.,"Estrategia y Planificación
 Participar y apoyar la planificación de capacidades y el desarrollo de objetivos estratégicos a largo plazo para soluciones de colaboración y mensajería basadas en Exchange junto con los usuarios finales y los gerentes de departamento.
 
 Adquisición y Desarrollo
 Coordinar con funciones de ingeniería de redes aplicaciones comerciales y administración de bases de datos para implementar sistemas Exchange que utilicen las mejores prácticas de la industria para cumplir con los objetivos empresariales.
 Instalar configurar e iniciar servidores software y cualquier equipo necesario de Microsoft Exchange.
 
 Gestión Operativa
 Realizar todas las tareas necesarias para cumplir con los acuerdos de nivel de servicio relacionados con la mensajería basada en Exchange y la disponibilidad y seguridad de la colaboración incluidos aquellos que involucran cuentas de usuario carpetas/calendarios compartidos listas de correo y Outlook Web Access.
 Implementar políticas procedimientos y tecnologías para garantizar la seguridad del servidor Exchange mediante acceso seguro monitoreo control y evaluaciones de seguridad de rutina.
 Administrar bases de datos de Exchange aplicaciones antivirus filtrado de mensajes y seguimiento de registros de errores.
 Recomendar programar y realizar parches actualizaciones y/o compras de software.
 Asegurar que las implementaciones del servidor Exchange cumplan con las políticas estándares acuerdos de licencia y pautas de configuración.
 Mantener información actualizada sobre leyes tendencias y cuestiones incluidas las tecnologías actuales y emergentes y las mejores prácticas relacionadas con Exchange y la mensajería electrónica. 
 Realizar el archivado recuperación y eliminación de mensajes de acuerdo con las mejores prácticas para mantener el cumplimiento normativo.
 Anticipar mitigar identificar responder y resolver problemas que afectan el rendimiento la eficiencia y la disponibilidad de los sistemas de mensajería.
 Proporcionar soporte técnico de vanguardia para los usuarios finales.
 Apoyar a los equipos de desarrollo de aplicaciones y migraciones de software a nuevas plataformas de servidores de correo electrónico o versiones más recientes de Exchange.
 Supervisar probar y analizar las actividades del software del servidor y del sistema de correo electrónico para garantizar el máximo rendimiento eficiencia y disponibilidad.
 Evaluar la necesidad de cualquier reconfiguración del sistema de mensajería (menor o significativa) y ejecutarla si es necesario.
 Crear los informes requeridos en respuesta a las necesidades del negocio.
 Desarrollar implementar documentar y mantener políticas procedimientos y planes de capacitación asociados para la administración y el uso apropiado del sistema de mensajería.","Educación formal y certificación
 Diploma universitario o título universitario en el campo de la informática y/o […] años de experiencia laboral equivalente.
 Certificaciones que incluyen [MCSE 2000 o 2003 …].
 
 Conocimiento y experiencia
 Experiencia comprobada con la administración de Microsoft Exchange 2003 con […] años de experiencia.
 Conocimiento técnico práctico del software protocolos y estándares actuales de sistemas de mensajería y colaboración incluidos Microsoft SharePoint Blackberry Enterprise Server y […].
 Conocimiento de las mejores prácticas de la industria para la privacidad del correo electrónico y el cumplimiento normativo enrutamiento filtrado monitoreo almacenamiento por niveles respaldo y recuperación ante desastres.
 Fuerte conocimiento práctico de gestión de parches y prácticas de control de cambios.
 Experiencia práctica en resolución de problemas de software y hardware.
 Amplia experiencia con Active Directory.
 Amplia experiencia en soporte con arquitectura de aplicaciones IIS y .NET.
 Conocimiento técnico práctico de la arquitectura agrupada de Exchange 2000/2003.
 Experiencia con el manejo de bases de datos de Microsoft SQL Server.
 Experiencia en diseño de alta disponibilidad (sistemas de conmutación por error y replicación de datos).
 Exposición previa a tecnologías de virtualización de servidores.
 Experiencia previa en migración a Exchange 2003.
 Buen conocimiento de las metas y objetivos de la organización.
 
 Atributos personales
 Fuerte orientación al servicio al cliente.
 Capacidad analítica y de resolución de problemas demostradas.
 Capacidad para priorizar y ejecutar tareas de manera efectiva en un entorno de alta presión.
 Fuertes habilidades de comunicación interpersonal y oral.
 Hábil para trabajar en un entorno colaborativo y orientado al equipo.
 Capacidad para presentar ideas y soluciones en un lenguaje amigable para los negocios y para el usuario.
 Capacidad para realizar investigaciones sobre problemas y productos de software de correo electrónico según sea necesario.
 Altamente automotivado y dirigido.
 Gran atención al detalle."
1. Infraestructura Operaciones,INF004,Infraestructura y Operaciones,Contribución Individual,Técnico Audiovisual (AV),La función del Técnico Audiovisual es respaldar y mantener equipos audiovisuales internos y activos de medios no impresos. Esto incluye operar mantener distribuir instalar configurar reparar y actualizar diversos productos electrónicos garantizando al mismo tiempo su rendimiento óptimo. Esta persona también solucionará áreas problemáticas de manera oportuna y precisa y brindará capacitación y asistencia al usuario final cuando sea necesario.,"Estrategia y Planificación
 Ayudar a desarrollar estrategias a largo plazo y planificación de capacidad para satisfacer las futuras necesidades de equipos audiovisuales y tecnología corporativa. 
 Colaborar con los responsables de políticas organizacionales para establecer y hacer cumplir prácticas y procedimientos AV adecuados.
 
 Adquisición e Implementación
 Mantener conocimientos actualizados sobre los contratos de equipos audiovisuales y supervisar las instalaciones basadas en contratos.
 Asesorar en la compra de nuevos equipos AV ayudar con su instalación.
 Realizar investigaciones y hacer recomendaciones sobre productos audiovisuales en apoyo de los esfuerzos de adquisición y desarrollo.
 Realizar pedidos de equipos y consumibles audiovisuales Inspeccione y verifique todas las entregas de AV al recibirlas.
 
 Gestión Operativa
 Identificar y entregar los niveles de servicio audiovisual requeridos de acuerdo con las políticas de la empresa y los requisitos del usuario.
 Instalar configurar probar mantener monitorear y solucionar problemas de equipos de teleconferencia dispositivos multimedia televisores monitores proyectores equipos de grabación juegos de parlantes cámaras/videocámaras digitales y otros equipos de presentación.
 Recibir y responder a llamadas entrantes páginas y/o correos electrónicos relacionados con problemas de software/hardware AV.
 Realizar análisis diagnóstico y resolución in situ de problemas complejos de hardware AV para una variedad de usuarios finales y recomendar e implementar soluciones correctivas incluida la reparación externa según sea necesario.
 Documentar los casos de falla reparación instalación y desinstalación de equipos AV.
 Construir y mantener un inventario de repuestos para todos los equipos AV.
 Manejar las solicitudes de reserva entrantes para equipos y configuración AV.
 Solucionar problemas AV utilizando las herramientas de prueba adecuadas hacer las reparaciones necesarias.
 Transportar el equipo audiovisual por las instalaciones utilizando una transpaleta motorizada o un carrito de mano.
 Etiquetar equipos audiovisuales propiedad de la organización Auditar periódicamente los inventarios para mitigar el riesgo de daños o robo.
 Producir duplicar editar y copiar todos los medios AV según sea necesario.","Educación formal y certificación
 Diploma universitario o título universitario en el campo de la electrónica informática y/o […] años de experiencia laboral equivalente.
 Certificaciones en […].
 
 Conocimiento y experiencia
 Excelente conocimiento técnico de teleconferencias presentaciones y otro hardware audiovisual incluido […].
 Experiencia práctica integral en resolución de problemas de equipos AV.
 Amplia experiencia en soporte de equipos con […].
 Buen conocimiento de los protocolos de red sistemas operativos software y estándares actuales incluidos […].
 Mecánicamente inclinado. ¿?
 Capacidad para operar herramientas componentes y accesorios periféricos.
 Capaz de leer y comprender manuales técnicos documentación de procedimientos y guías OEM.
 Capacidad para realizar investigaciones sobre productos y problemas de hardware según sea necesario.
 Comprensión de las metas y objetivos de la organización.
 
 Atributos personales
 Habilidades interpersonales efectivas y habilidades para construir relaciones.
 Fuerte orientación al servicio al cliente.
 Fuertes habilidades de comunicación oral y escrita.
 Automotivado y dirigido.
 Gran atención al detalle.
 Capacidad analítica y de resolución de problemas.
 Capaz de priorizar y ejecutar tareas en un entorno de alta presión.
 Experiencia trabajando en un entorno colaborativo y orientado al equipo."
